{
  "$schema": "http://json-schema.org/draft-07/schema#",
  "title": "GCL Quality Summary",
  "description": "Aggregated output from scripts/gcl_trace_aggregate.py (AGENTS.md GCL Phase 3). Owned by qcloud-monitor-ops; consumed by gcl-quality-dashboard.md and proactive-inspection reporting embed.",
  "type": "object",
  "required": ["version", "generated_at", "totals", "pass_rate", "by_skill"],
  "properties": {
    "version": { "type": "string", "const": "1.0" },
    "generated_at": { "type": "string", "format": "date-time" },
    "window": {
      "type": "object",
      "properties": {
        "trace_count": { "type": "integer", "minimum": 0 }
      }
    },
    "totals": {
      "type": "object",
      "required": ["total_runs", "PASS", "SAFETY_FAIL", "MAX_ITER"],
      "properties": {
        "total_runs": { "type": "integer", "minimum": 0 },
        "PASS": { "type": "integer", "minimum": 0 },
        "SAFETY_FAIL": { "type": "integer", "minimum": 0 },
        "MAX_ITER": { "type": "integer", "minimum": 0 }
      }
    },
    "pass_rate": { "type": "number", "minimum": 0, "maximum": 1 },
    "avg_rubric_scores": {
      "type": "object",
      "properties": {
        "correctness": { "type": ["number", "null"] },
        "safety": { "type": ["number", "null"] },
        "idempotency": { "type": ["number", "null"] },
        "traceability": { "type": ["number", "null"] },
        "spec_compliance": { "type": ["number", "null"] }
      }
    },
    "by_skill": {
      "type": "object",
      "additionalProperties": {
        "type": "object",
        "properties": {
          "total": { "type": "integer" },
          "PASS": { "type": "integer" },
          "SAFETY_FAIL": { "type": "integer" },
          "MAX_ITER": { "type": "integer" },
          "avg_iterations": { "type": "number" }
        }
      }
    },
    "critic_mode_counts": {
      "description": "F14 — runs bucketed by Critic provenance (iterations[-1].critic._mode written by scripts/gcl_runner.py). Non-empty `missing` means the trace predates the provenance field; a non-zero `structural-only-fallback` means rule-based scores were substituted after an LLM Critic failure (timeout / rate limit / invalid JSON) and MUST NOT be read as LLM-Critic verdicts.",
      "type": "object",
      "properties": {
        "llm-builtin": { "type": "integer", "minimum": 0 },
        "structural-only": { "type": "integer", "minimum": 0 },
        "structural-only-fallback": { "type": "integer", "minimum": 0 },
        "missing": { "type": "integer", "minimum": 0 }
      },
      "additionalProperties": { "type": "integer", "minimum": 0 }
    },
    "structural_fallback_runs": {
      "description": "Explicit count of `structural-only-fallback` runs (0 when none).",
      "type": "integer",
      "minimum": 0
    },
    "structural_fallback_ratio": {
      "description": "structural_fallback_runs / totals.total_runs (0.0 for an empty window).",
      "type": "number",
      "minimum": 0,
      "maximum": 1
    },
    "structural_fallback_max_ratio": {
      "description": "Threshold actually applied, read from assets/shared/thresholds.json key `gcl_structural_fallback_max_ratio`. Missing/invalid config fails closed to 0.0.",
      "type": "number",
      "minimum": 0,
      "maximum": 1
    },
    "structural_fallback_breach": {
      "description": "true when structural_fallback_ratio exceeds structural_fallback_max_ratio. Alarm paths must treat true as 'pass_rate is rule-based, not LLM-scored'.",
      "type": "boolean"
    },
    "structural_fallback_threshold_configured": {
      "description": "false when the threshold was absent/invalid and fail-closed to 0.0 was applied.",
      "type": "boolean"
    },
    "trace_files": {
      "type": "array",
      "items": { "type": "string" }
    }
  }
}
