{
  "version": "1.0",
  "generated_at": "2026-06-19T00:00:00+00:00",
  "window": {
    "trace_count": 20
  },
  "totals": {
    "PASS": 19,
    "SAFETY_FAIL": 0,
    "MAX_ITER": 1,
    "total_runs": 20
  },
  "pass_rate": 0.95,
  "avg_rubric_scores": {
    "correctness": 1.0,
    "safety": 1.0,
    "idempotency": 0.95,
    "traceability": 1.0,
    "spec_compliance": 1.0
  },
  "by_skill": {
    "qcloud-well-architected-review": {
      "total": 20,
      "PASS": 19,
      "SAFETY_FAIL": 0,
      "MAX_ITER": 1,
      "avg_iterations": 1.05
    }
  },
  "trace_files": []
}
